{
  "request_id": "req-005",
  "tenant_id": "tenant-acme",
  "risk_score": 93,
  "verdict": "block",
  "reasons": [
    "reason_spike",
    "reason_multi"
  ],
  "evidence_id": "db204f8d-7135-4b42-906f-4f31cf535028",
  "policy_trace": {
    "off": true,
    "severity": "L3",
    "walls_triggered": [
      "secret_exfiltration"
    ],
    "source": "omega"
  }
}
